{"$schema":"https://raw.githubusercontent.com/wilanis/wilanis-js/main/packages/core/schemas/answers.schema.json","description":"The node answers and stub values the scenarios under scenarios/rehearsed/ share, each once, under its digest. Written by wilanis rehearse --record; regenerate it, do not edit it.","generated":"rehearse","nodes":{
"0b1e8a955f72e153":{"out":"rejected","selected":"rejected","status":"done"},
"10db6eb0a3e8a4d8":{"handler":"@std/object.port.json#make","out":{"accessToken":"«secret»","expiresIn":200,"refreshToken":"«secret»","sessionId":"«secret»","tokenType":"kilo"},"status":"done"},
"12d7698d180bba4a":{"handler":"@auth/token.port.json#issue","out":{"accessToken":"«secret»","expiresIn":200,"refreshToken":"«secret»","sessionId":"echo","tokenType":"Bearer"},"status":"done"},
"17a3892488c5d826":{"handler":"@features/access-dev/data/identity.binding.json#verifyEmployee","out":{"identity":{"attributes":{},"groups":["golf","golf"],"name":"Zulu-9612","subject":"hotel"},"status":"unavailable"},"status":"done"},
"1ae2b2bed6ebbc6d":{"out":"anonymous","selected":"anonymous","status":"done"},
"227fd6a56ac910df":{"handler":"@features/access-dev/data/identity.binding.json#verifyEmployee","out":{"identity":{"attributes":{},"groups":["golf","golf"],"name":"Zulu-9612","subject":"hotel"},"status":"rejected"},"status":"done"},
"30dd9fbae1e8597f":{"handler":"graph:@features/access/domain/sign-in-customer.graph.json","reason":"directory_unavailable","status":"failed"},
"344d3ee2bdf6d5e1":{"handler":"@auth/session.port.json#end","out":{"ended":true},"status":"done"},
"44e04c9a749491aa":{"out":"issued","selected":"issued","status":"done"},
"48a7ed21dc975da6":{"handler":"graph:@features/access/domain/sign-in-customer.graph.json","out":{"accessToken":"«secret»","expiresIn":200,"refreshToken":"«secret»","sessionId":"echo","tokenType":"Bearer"},"status":"done"},
"4f52e7e45a0d9c23":{"out":"renewed","selected":"renewed","status":"done"},
"51a92a6b33d535e4":{"handler":"@std/object.port.json#make","out":{"allowed":true},"status":"done"},
"55acd61e20316d98":{"handler":"@std/outcome.port.json#refuse","reason":"directory_unavailable","status":"failed"},
"6279fd8c522eb873":{"handler":"@auth/challenge.port.json#issue","out":{"code":"«secret»","expiresAt":"foxtrot","issued":false},"status":"done"},
"6736141a740b3f5d":{"handler":"@auth/challenge.port.json#issue","out":{"code":"«secret»","expiresAt":"foxtrot","id":"juliet527","issued":true},"status":"done"},
"6b3d11bcb3827b0d":{"handler":"@std/outcome.port.json#refuse","reason":"bad_credentials","status":"failed"},
"6db654b70b91fe66":{"handler":"@features/access-dev/data/identity.binding.json#verifyCustomer","out":{"identity":{"attributes":{"tenant":"golf154"},"groups":["golf","golf"],"name":"Zulu-9612","subject":"hotel"},"status":"verified"},"status":"done"},
"77bd36e8ed356cdb":{"handler":"@std/outcome.port.json#refuse","reason":"anonymous","status":"failed"},
"7920c717e116377e":{"handler":"graph:@features/access/data/read-session.graph.json","out":{"displayName":"Zulu-9","realm":"hotel","tenant":"juliet"},"status":"done"},
"7a7e99a900725155":{"out":"unavailable","selected":"unavailable","status":"done"},
"7d082c4ec9328f4c":{"handler":"graph:@features/access/domain/sign-in-employee.graph.json","reason":"directory_unavailable","status":"failed"},
"8af6d2fd19da8b84":{"handler":"graph:@features/access/domain/refresh.graph.json","out":{"accessToken":"«secret»","expiresIn":200,"refreshToken":"«secret»","sessionId":"«secret»","tokenType":"kilo"},"status":"done"},
"93fa0c8c94507a08":{"handler":"graph:@features/access/data/write-theme.graph.json","out":{"displayName":"foxtrot","realm":"india500","tenant":""},"status":"done"},
"9a5571332abd82e5":{"handler":"@std/outcome.port.json#refuse","reason":"unknown_challenge","status":"failed"},
"a0af58eabbdc1659":{"status":"cancelled"},
"a9cc547d10b6481f":{"handler":"graph:@features/access/data/issue-code.graph.json","reason":"unknown_challenge","status":"failed"},
"afbf4c0f93a34634":{"handler":"@features/access-dev/data/identity.binding.json#verifyEmployee","out":{"identity":{"attributes":{},"groups":["golf","golf"],"name":"Zulu-9612","subject":"hotel"},"status":"verified"},"status":"done"},
"b39c726bc01a1962":{"handler":"@auth/session.port.json#get","out":{"displayName":"Zulu-9","realm":"hotel","tenant":"juliet"},"status":"done"},
"b6c0b1636b8fb1fb":{"handler":"graph:@features/access/domain/require-signed-in.graph.json","reason":"anonymous","status":"failed"},
"c168ca9edef17b35":{"handler":"@features/access-dev/data/identity.binding.json#issue","out":{"accessToken":"«secret»","expiresIn":200,"refreshToken":"«secret»","sessionId":"echo","tokenType":"Bearer"},"status":"done"},
"c3f0cb545e8be726":{"handler":"@auth/session.port.json#set","out":{"displayName":"foxtrot","realm":"india500","tenant":""},"status":"done"},
"c6915a5962857c1e":{"out":"code","selected":"code","status":"done"},
"d033bc28ec710dbb":{"handler":"graph:@features/access/domain/sign-in-employee.graph.json","out":{"accessToken":"«secret»","expiresIn":200,"refreshToken":"«secret»","sessionId":"echo","tokenType":"Bearer"},"status":"done"},
"db21d6cff9d2b539":{"handler":"@features/access-dev/data/identity.binding.json#refresh","out":{"refreshed":false,"tokens":{"accessToken":"«secret»","expiresIn":200,"refreshToken":"«secret»","sessionId":"«secret»","tokenType":"kilo"}},"status":"done"},
"e14bf6d05520f547":{"out":"unknown","selected":"unknown","status":"done"},
"e7760afe95a1a7da":{"handler":"@std/object.port.json#make","out":{"code":"«secret»","expiresAt":"foxtrot","id":"juliet527"},"status":"done"},
"e8eb2ce97666bc8a":{"handler":"graph:@features/access/data/end-session.graph.json","out":{"ended":true},"status":"done"},
"ea2f842692b392ff":{"handler":"@features/access-dev/data/identity.binding.json#verifyCustomer","out":{"identity":{"attributes":{"tenant":"golf154"},"groups":["golf","golf"],"name":"Zulu-9612","subject":"hotel"},"status":"rejected"},"status":"done"},
"ebd396b4240736b3":{"handler":"graph:@features/access/data/issue-code.graph.json","out":{"code":"«secret»","expiresAt":"foxtrot","id":"juliet527"},"status":"done"},
"ee34fa60b6bba081":{"out":"granted","selected":"granted","status":"done"},
"ee68b33b894010e1":{"handler":"@features/access-dev/data/identity.binding.json#refresh","out":{"refreshed":true,"tokens":{"accessToken":"«secret»","expiresIn":200,"refreshToken":"«secret»","sessionId":"«secret»","tokenType":"kilo"}},"status":"done"},
"ef33449a60a9c3f0":{"handler":"graph:@features/access/domain/sign-in-customer.graph.json","reason":"bad_credentials","status":"failed"},
"f9d0b1364fd52185":{"handler":"@features/access-dev/data/identity.binding.json#verifyCustomer","out":{"identity":{"attributes":{"tenant":"golf154"},"groups":["golf","golf"],"name":"Zulu-9612","subject":"hotel"},"status":"unavailable"},"status":"done"},
"fa77c98fababcce9":{"out":"invalid","selected":"invalid","status":"done"},
"fab0a7861aeba884":{"handler":"graph:@features/access/domain/require-signed-in.graph.json","out":{"allowed":true},"status":"done"},
"fcbe274498ece88e":{"handler":"@std/outcome.port.json#refuse","reason":"invalid_refresh","status":"failed"},
"fef2589a938dc2ff":{"handler":"graph:@features/access/domain/sign-in-employee.graph.json","reason":"bad_credentials","status":"failed"},
"ff006c58f227f471":{"handler":"graph:@features/access/domain/refresh.graph.json","reason":"invalid_refresh","status":"failed"}
},"stubs":{
"050e5111656fa128":{"identity":{"attributes":{"tenant":"golf154"},"groups":["golf","golf"],"name":"Zulu-9612","subject":"hotel"},"status":"unavailable"},
"3698d101152dfac8":{"code":"echo","expiresAt":"foxtrot","issued":false},
"37549bc5f9823379":{"identity":{"attributes":{"tenant":"golf154"},"groups":["golf","golf"],"name":"Zulu-9612","subject":"hotel"},"status":"rejected"},
"44e600c42e494d47":{"displayName":"foxtrot","realm":"india500","tenant":""},
"47ce3f9908163d80":{"ended":true},
"5ad93d816ab1de08":{"refreshed":true,"tokens":{"accessToken":"hotel","expiresIn":200,"refreshToken":"Zulu-9612","sessionId":"hotel403","tokenType":"kilo"}},
"6f3f2a0fdea042b7":{"code":"echo","expiresAt":"foxtrot","id":"juliet527","issued":true},
"857d8787e1f96643":{"refreshed":false,"tokens":{"accessToken":"hotel","expiresIn":200,"refreshToken":"Zulu-9612","sessionId":"hotel403","tokenType":"kilo"}},
"8a872193b265045d":{"displayName":"Zulu-9","realm":"hotel","tenant":"juliet"},
"964982550b8ba9ed":{"accessToken":"x","expiresIn":200,"refreshToken":"foxtrot","sessionId":"echo","tokenType":"Bearer"},
"9d3de8efac751c8e":{"identity":{"attributes":{"tenant":"golf154"},"groups":["golf","golf"],"name":"Zulu-9612","subject":"hotel"},"status":"verified"},
"c96587ceadaed5b4":{"identity":{"attributes":{},"groups":["golf","golf"],"name":"Zulu-9612","subject":"hotel"},"status":"rejected"},
"cefa8869498e2317":{"identity":{"attributes":{},"groups":["golf","golf"],"name":"Zulu-9612","subject":"hotel"},"status":"unavailable"},
"e65bb71f79c36fae":{"identity":{"attributes":{},"groups":["golf","golf"],"name":"Zulu-9612","subject":"hotel"},"status":"verified"}
}}
